{
  "schema_version": "0.2",
  "assessment_id": "SYNTHETIC-002-IA-001",
  "assessment_status": "provisional",
  "receiving_owner": "possibility-to-capability",
  "source_packet_ref": {
    "packet_id": "SYNTHETIC-002",
    "packet_digest": "19ad7995bea9c77214fffb3d8660ef3d7e9104649892c883a09a1632b2967c9b",
    "source_revision": "0123456789abcdef0123456789abcdef01234567"
  },
  "source_wording": {
    "exact_independence_scope": "Internal non-forcing within the declared source model; no claim of premise-independent evidential replication.",
    "source_independence_type": "model_relative_non_forcing",
    "source_claim_status": "exploration"
  },
  "classification": {
    "independence_type": "model_relative_non_forcing",
    "basis_method_ids": ["M1", "M2"],
    "limiting_premise_ids": ["P1"],
    "rationale": "The typed receiving classification preserves the source's model-relative scope and explicitly carries the shared construction premise."
  },
  "guards": {
    "source_wording_preserved": true,
    "source_status_unchanged": true,
    "authority_transfer": false,
    "no_strength_upgrade": true
  },
  "nonclaims": [
    "This assessment does not convert two methods into two independent evidential units.",
    "This assessment does not upgrade the source claim status."
  ],
  "falsifiers": [
    "The copied source wording differs from the frozen packet.",
    "The classification requires a stronger independence type than the source supplied.",
    "A named basis method or limiting premise is absent from the frozen packet."
  ]
}
